{
  "schema_version": "sce.customer_module_manifest.v1",
  "module_key": "sce_customer_sample",
  "customer_key": "sample",
  "tenant_key": "sample",
  "module_name": "sce_customer_sample",
  "module_version": "17.0.1.3.0",
  "minimum_product_version": "17.0.0",
  "maximum_tested_product_version": "17.0.0",
  "payload_manifest_version": "tenant_payload_v1",
  "product_interface_version": "1",
  "supported_source_versions": ["synthetic-v1"],
  "model_import_order": ["companies", "partners", "attachments"],
  "external_key_mapping": ["sc.tenant.payload.external.identity"],
  "install_mode": "customer_database_only",
  "product_bundle": "smart_construction_bundle",
  "product_version_range": {
    "min_inclusive": "17.0.0",
    "max_exclusive": "18.0.0"
  },
  "payload_required": false,
  "company_keys": [],
  "role_keys": [],
  "uninstall_policy": "fail_closed"
}
